{
  "contract": "fluxrt-h3-alignment-offset",
  "version": 1,
  "motor_id": "DengFOC-M0-AS5600-on-G431",
  "pole_pairs": 7,
  "mechanical_direction": 1,
  "alignment_state": 3,
  "requirements": {
    "minimum_alignment_samples": 10,
    "settled_tail_sample_count": 20,
    "maximum_candidate_deviation_rad": 0.02,
    "maximum_forced_angle_deviation_rad": 0.001
  },
  "aligned_csv_path": "profiles/identification/sessions/h3-dynamic-20261005-session2026100512-v22-terminal20ms-partial-diagnostic/aligned.csv",
  "aligned_csv_sha256": "AE18F70AF03DE319CC6B9D0587601E5C11C48FBC9E619B1758FF1AB84C88190B",
  "parameter_approval": "not-granted",
  "target_capability_approval": "not-granted"
}
