{
  "contract": "fluxrt-h3-alignment-offset",
  "version": 1,
  "motor_id": "DengFOC-M0-AS5600-on-G431",
  "pole_pairs": 7,
  "mechanical_direction": 1,
  "alignment_state": 3,
  "requirements": {
    "minimum_alignment_samples": 10,
    "settled_tail_sample_count": 20,
    "maximum_candidate_deviation_rad": 0.02,
    "maximum_forced_angle_deviation_rad": 0.001
  },
  "aligned_csv_path": "profiles/identification/sessions/h3-dynamic-20261005-session2026100513-deng250hz/aligned.csv",
  "aligned_csv_sha256": "5E8DB2ACC3AD89535633E7C2F210F5AA12EF798E347C6FD5349EEEDA52823125",
  "parameter_approval": "not-granted",
  "target_capability_approval": "not-granted"
}
